{
  "success": true,
  "batch_id": "2d4f6a8c-0e1b-4d3f-a5c7-9e0b2d4f6a8c",
  "sync": {
    "accepted": 5,
    "created": 3,
    "updated": 2,
    "rejected": 0
  },
  "rejected_records": [],
  "cursor": "eyJzZXF1ZW5jZSI6NDUsImJhdGNoX2lkIjoiMmQ0ZjZhOGMtMGUxYi00ZDNmLWE1YzctOWUwYjJkNGY2YThjIiwiYWNrZWRfYXQiOiIyMDI2LTA5LTIzVDEyOjE1OjAxWiJ9",
  "settings_version": 5,
  "server_time": "2026-09-23T12:15:01Z"
}
